Type	#	user	text	nextType	#	
choice	38	Player	you’re amazing	goodending	32	
goodending	32	b	haha, thanks	block	1	
goodending	33	b	haha, good bye ;P	block	1	
						
badending1	0	b	walking through the flooded waters isn’t that bad	badending1	1	
badending1	1	b	feels a bit refreshing, if you ask me	badending1	2	
badending1	2	b	if only the waters weren’t so dir	badending1	3	
badending1	3	a	‘dir’, what?	notif	0	
						
notif	0	system	b went offline	badending1	4	
						
badending1	4	a	b???	choice	39,40	
choice	39	Player	maybe he got electrocuted	badending1	5	
choice	40	Player	maybe his cell phone fell into the water	badending1	5	
badending1	5	a	Now’s not the time to joke around!	badending1	6	
badending1	6	a	Let’s hope he gets back home safe	badending1	7	
						
badending1	7	a	b hasn’t contacted us in a while… I have a bad feeling about this	choice	41,42	
choice	41	Player	me too..	badending1	8	
choice	42	Player	it’s my fault	badending1	8	
badending1	8	a	If something bad did happen to him, it’s not your fault nor mine alone	badending1	9	
badending1	9	a	It’s both ours	notif	1	
						
notif	1	system	b is online	badending1	10	
						
badending1	10	a	b!!	badending1	11	
badending1	11	a	I knew it! You’re safe!	badending1	12	
badending1	12	b	a, [name]	badending1	13	
badending1	13	a	What happened last time?? Why did you suddenly stop messaging us like that?	badending1	14	
badending1	14	a	We were so worried	badending1	15	
badending1	15	b	I’m sorry	badending1	16	
badending1	16	b	but this is not b	badending1	17	
badending1	17	b	this is his mother	badending1	18	
badending1	18	b	we took the shortest way back home, but the flood was still pretty deep and foggy	badending1	19	
badending1	19	b	we couldn’t see anything under the water	badending1	20	
badending1	20	b	we were also unfamiliar with the roads and… well…	badending1	21	
badending1	21	b	we didn’t know that there was an open gutter	badending1	22	
badending1	22	b	and he…	badending1	23	
badending1	23	b	i’m sorry i have no heart to tell you in detail what happened	badending1	24	
badending1	24	b	just know that what happened to b is neither of your faults	badending1	25	
badending1	25	b	it’s mine	badending1	26	
badending1	26	b	both of you tried your best to guide and help b, well, us, through the storm surge, and I, as his mother couldn’t do anything	badending1	27	
badending1	27	b	despite what happened to b, we are truly thankful for both of your guidance	badending1	28	
badending1	28	b	i promise to read more on disaster preparedness	badending1	29	
badending1	29	b	and i hope you do too	badending1	30	
badending1	30	b	once again, thank you, and farewell	block	2	
						
block	0	system	woops, can't select this option yet!	stop	0	
block	1	system	congratulations, you have reached the good ending!	stop	0	
block	2	system	you have reached Bad Ending 1, please try again to get the good ending	stop	0	